titular,url
Narcovuelo enfrenta a Bukele con Harfuch; cruzan tuits con versiones de la ruta,https://www.eluniversal.com.mx/nacion/narcovuelo-enfrenta-a-bukele-con-harfuch-cruzan-tuits-con-acusaciones/
Las rutas de un narcovuelo que confronta a Bukele con Harfuch; estos son los mapas,https://www.eluniversal.com.mx/nacion/las-rutas-de-un-narcovuelo-que-confronta-a-bukele-con-harfuch-estos-son-los-mapas/
"La mañanera de Sheinbaum, 10 de julio, minuto a minuto",https://www.eluniversal.com.mx/nacion/la-mananera-de-sheinbaum-10-de-julio-minuto-a-minuto/
"“Salas de la SCJN sólo generaron dispendio”: Irving Espinosa, ministro electo",https://www.eluniversal.com.mx/nacion/salas-de-la-scjn-solo-generaron-dispendio-irving-espinosa-ministro-electo/
“Hay que dar a exmilitares en Colombia vías de reincorporación”: Carlos Ruiz Massieu,https://www.eluniversal.com.mx/mundo/hay-que-dar-a-exmilitares-en-colombia-vias-de-reincorporacion-carlos-ruiz-massieu/
La inflación dura se vuelve veloz y enciende las alertas,https://www.eluniversal.com.mx/cartera/la-inflacion-dura-se-vuelve-veloz-y-enciende-las-alertas/
Plantean regular uso del suelo para controlar gentrificación,https://www.eluniversal.com.mx/metropoli/plantean-regular-uso-del-suelo-para-controlar-gentrificacion/
EU anuncia nuevo cierre de frontera al paso del ganado mexicano; detectan nuevo caso de gusano barrenador en Veracruz,https://www.eluniversal.com.mx/mundo/secretaria-de-agricultura-de-eu-anuncia-nuevo-cierre-de-frontera-con-mexico-por-gusano-barrenador-frena-importaciones-nuevamente/
Corte ordena a Layda Sansores retirar audios filtrados de Monreal y Alito Moreno; resuelve que vulneró derecho a la privacidad,https://www.eluniversal.com.mx/nacion/corte-ordena-a-layda-sansores-retirar-audios-filtrados-de-monreal-y-alito-moreno-vulnero-su-derecho-a-la-privacidad/
TEPJF ratifica sanción contra Cuauhtémoc Blanco por violencia política; será puesto en el registro de violentadores,https://www.eluniversal.com.mx/nacion/tepjf-ratifica-sancion-contra-cuauhtemoc-blanco-por-violencia-politica-sera-puesto-en-el-registro-de-violentadores/
Comunidad exige justicia por feminicidio de Keila,https://www.eluniversal.com.mx/estados/comunidad-exige-justicia-por-feminicidio-de-keila/
Profepa decomisa 43 aves silvestres en la CDMX; las tenían como mascotas en domicilio de la Condesa,https://www.eluniversal.com.mx/nacion/profepa-decomisa-43-aves-silvestres-en-la-cdmx-las-tenian-como-mascotas-en-domicilio-de-la-condesa/
Hackean cuenta de Instagram del Gobernador de Chiapas; pide no acceder a enlaces sospechosos,https://www.eluniversal.com.mx/estados/hackean-cuenta-de-instagram-del-gobernador-de-chiapas-pide-no-acceder-a-enlaces-sospechosos/
Empresa que “desextinguió” al lobo terrible ahora va por ave gigante extinta,https://www.eluniversal.com.mx/ciencia-y-salud/empresa-que-desextinguio-al-lobo-terrible-ahora-va-por-ave-gigante/
Sigue la búsqueda de 170 desaparecidos en Texas,https://www.eluniversal.com.mx/mundo/sigue-la-busqueda-de-170-desaparecidos-en-texas/
Trump anuncia arancel de 50% a Brasil; habrá respuesta: Lula,https://www.eluniversal.com.mx/mundo/trump-anuncia-arancel-de-50-a-brasil-habra-respuesta-lula/
"Otra cruzazuleada: queda en el limbo “Azul oscuro, azul celeste”",https://www.eluniversal.com.mx/espectaculos/otra-cruzazuleada-queda-en-el-limbo-azul-oscuro-azul-celeste/
América desprecia a estrella de la Selección de Estados Unidos,https://www.eluniversal.com.mx/opinion/barra-brava/america-desprecia-a-estrella-de-la-seleccion-de-estados-unidos/
Ahora va el Tren Ligero para el Edomex,https://www.eluniversal.com.mx/opinion/el-caballito/ahora-va-el-tren-ligero-para-el-edomex/
Destapando coladeras sin querer,https://www.eluniversal.com.mx/carton/kemchs/destapando-coladeras-sin-querer/
La Liga MX con nueva moda para el Apertura 2025; cambiar de técnico,https://www.eluniversal.com.mx/deportes/la-liga-mx-con-nueva-moda-para-el-apertura-2025-cambiar-de-tecnico/
Olympique de Lyon se queda en la Ligue 1; cancelan su descenso por problemas económicos,https://www.eluniversal.com.mx/deportes/olympique-de-lyon-se-queda-en-la-ligue-1-cancelan-su-descenso-por-problemas-economicos/
Lionel Messi impone récord en la MLS; el delantero sigue haciendo historia con el Inter Miami,https://www.eluniversal.com.mx/deportes/lionel-messi-impone-record-en-la-mls-el-delantero-sigue-haciendo-historia-con-el-inter-miami/
El reino de los Supermanes,https://www.eluniversal.com.mx/grafico/espectaculos/el-reino-de-los-supermanes/
"Dedican premier de ""Superman"" a rescatistas; James Gunn reivindica al superhéroe como inmigrante",https://www.eluniversal.com.mx/espectaculos/dedican-premier-de-superman-a-rescatistas-james-gunn-reivindica-al-superheroe-como-inmigrante/
"Yordi habla sobre caso Sasha Sokol y Luis de Llano:  ""Aprendí a tener mucho más cuidado con una situación tan delicada""",https://www.eluniversal.com.mx/espectaculos/yordi-aprendi-a-ser-mas-cuidadoso/
"Roku Streambar en oferta por menos de $1,800: ¿vale la pena?",https://www.eluniversal.com.mx/descubre-y-compra/roku-streambar-en-oferta-por-menos-de-1800-vale-la-pena/
"Prime day: iPhone 15 amarillo con 256 GB a precio rebajado y hasta 15 MSI en Amazon México, ¿vale la pena?",https://www.eluniversal.com.mx/descubre-y-compra/prime-day-iphone-15-amarillo-con-256-gb-a-precio-rebajado-y-hasta-15-msi-en-amazon-mexico-vale-la-pena/
"La pantalla Amazon Fire TV QLED de 75 pulgadas con $10,000 de descuento está volando: ¿conviene aprovechar en Prime Day?",https://www.eluniversal.com.mx/descubre-y-compra/la-pantalla-amazon-fire-tv-qled-de-75-pulgadas-con-10000-de-descuento-esta-volando-conviene-aprovechar-en-prime-day/
¡Adiós Christian Horner! el responsable de la salida de Checo Pérez,https://www.eluniversal.com.mx/autopistas/adios-christian-horner-el-responsable-de-la-salida-de-checo-perez/
Linda Yaccarino deja su cargo como CEO de X,https://www.eluniversal.com.mx/techbit/linda-yaccarino-deja-su-cargo-como-ceo-de-x/
¿Cuál fue la primera agencia de viajes en México?,https://www.eluniversal.com.mx/destinos/cual-fue-la-primera-agencia-de-viajes-en-mexico/
“Lady racista”: Maryfer Centeno reacciona a video de Ximena Pichel; “no tiene control de impulsos”,https://www.eluniversal.com.mx/tendencias/lady-racista-maryfer-centeno-reacciona-a-video-de-ximena-pichel-no-tiene-control-de-impulsos/
“Lady Ramona”: crean piñata de invasora de Tampico; así reaccionaron en redes sociales,https://www.eluniversal.com.mx/tendencias/lady-ramona-crean-pinata-de-invasora-de-tampico-asi-reaccionaron-en-redes-sociales/
"María Laura, esposa de Salinas Pliego, defiende a empresario tras señalamientos de Sheinbaum; esto dijo",https://www.eluniversal.com.mx/tendencias/maria-laura-esposa-de-salina-pliego-defiende-a-empresario-tras-senalamientos-de-sheinbaum-esto-dijo/
